{
  "$schema": "https://json-schema.org/draft/2020-12/schema",
  "type": "object",
  "properties": {
    "id": { "type": "string" },
    "services": {
      "type": "object",
      "properties": {
        "stream": { "type": "string" }
      },
      "required": ["stream"]
    },
    "subscribe": {
      "type": "object",
      "properties": {
        "topic": { "type": "string" },
        "group": { "type": "string" }
      },
      "required": ["topic", "group"]
    },
    "concurrency": { "type": "integer" },
    "timeout": { "type": "string" },
    "middleware": {
      "type": "array",
      "items": { "type": "string" }
    },
    "trigger": {
      "type": "object",
      "properties": {
        "workflow": { "type": "string" },
        "input": { "type": "object" }
      },
      "required": ["workflow"]
    },
    "dead_letter": {
      "type": "object",
      "properties": {
        "topic": { "type": "string" },
        "after": { "type": "integer" }
      }
    },
    "retry": {
      "type": "object",
      "properties": {
        "min_idle": { "type": "string" },
        "max_attempts": { "type": "integer" },
        "dlq": {
          "type": "string",
          "deprecated": true,
          "description": "Deprecated: use dead_letter.topic. Honored as an alias so older configs keep dead-lettering."
        }
      }
    }
  },
  "required": ["id", "services", "subscribe", "trigger"]
}
